{
  "archive_url": null,
  "content_sha256": "e1799b93651ddd1210fd245f5d92a6bcc368c133a977ddd747fae96b3f44bd0a",
  "effective_url": "https://thumbprint.design/",
  "http_status": 200,
  "inspected_locators": [
    "URL: https://thumbprint.design/"
  ],
  "limitations": [
    "Internal product metrics, unpublished design decisions, and closed-source implementation details were not inspected.",
    "The response hash proves retrieval of the owner source; evidence classification and review determine what the source supports.",
    "The live public source may change after this study date."
  ],
  "owner_url": "https://thumbprint.design/",
  "permitted_use_basis": "original-analysis-from-ordinary-public-access",
  "retrieved_at": "2026-09-01",
  "schema_version": "1.0",
  "source_scope_id": "thumbtack-thumbprint",
  "source_version": "live-public-source-2026-09-01:e1799b93651d",
  "terms_or_license_url": null,
  "third_party_assets_stored": false
}
