{
  "archive_url": null,
  "content_sha256": "80b7681210935f15d324fb157273f3c07a38f4f239bca15af29cf2c5b6ad7642",
  "effective_url": "https://design.va.gov/",
  "http_status": 200,
  "inspected_locators": [
    "URL: https://design.va.gov/"
  ],
  "limitations": [
    "Internal product metrics, unpublished design decisions, and closed-source implementation details were not inspected.",
    "The response hash proves retrieval of the owner source; evidence classification and review determine what the source supports.",
    "The live public source may change after this study date."
  ],
  "owner_url": "https://design.va.gov/",
  "permitted_use_basis": "original-analysis-from-ordinary-public-access",
  "retrieved_at": "2026-09-01",
  "schema_version": "1.0",
  "source_scope_id": "va-design-system",
  "source_version": "live-public-source-2026-09-01:80b768121093",
  "terms_or_license_url": null,
  "third_party_assets_stored": false
}
