{
  "archive_url": null,
  "content_sha256": "7ee80d740765448da04a197ce02b4a4f1eaebb205ff7371bc3394ba98996e0b8",
  "effective_url": "https://blog.duolingo.com/hub/design/",
  "http_status": 200,
  "inspected_locators": [
    "URL: https://design.duolingo.com/"
  ],
  "limitations": [
    "Internal product metrics, unpublished design decisions, and closed-source implementation details were not inspected.",
    "The response hash proves retrieval of the owner source; evidence classification and review determine what the source supports.",
    "The live public source may change after this study date."
  ],
  "owner_url": "https://design.duolingo.com/",
  "permitted_use_basis": "original-analysis-from-ordinary-public-access",
  "retrieved_at": "2026-09-01",
  "schema_version": "1.0",
  "source_scope_id": "duolingo-design",
  "source_version": "live-public-source-2026-09-01:7ee80d740765",
  "terms_or_license_url": null,
  "third_party_assets_stored": false
}
