{
  "archive_url": null,
  "content_sha256": "19e74cd3c20f6506f5ad4640addef6d3365363cc6450a0f5984290f9036aa56d",
  "effective_url": "https://framework7.io/docs/",
  "http_status": 200,
  "inspected_locators": [
    "URL: https://framework7.io/docs/"
  ],
  "limitations": [
    "Internal product metrics, unpublished design decisions, and closed-source implementation details were not inspected.",
    "The response hash proves retrieval of the owner source; evidence classification and review determine what the source supports.",
    "The live public source may change after this study date."
  ],
  "owner_url": "https://framework7.io/docs/",
  "permitted_use_basis": "original-analysis-from-ordinary-public-access",
  "retrieved_at": "2026-09-01",
  "schema_version": "1.0",
  "source_scope_id": "framework7",
  "source_version": "live-public-source-2026-09-01:19e74cd3c20f",
  "terms_or_license_url": null,
  "third_party_assets_stored": false
}
