{
  "archive_url": null,
  "content_sha256": "f4497ae45757894244c8f544493a4354a6c74a3a3d29723673a7d5e90f73aecd",
  "effective_url": "https://design.visa.com/",
  "http_status": 200,
  "inspected_locators": [
    "URL: https://design.visa.com/"
  ],
  "limitations": [
    "Internal product metrics, unpublished design decisions, and closed-source implementation details were not inspected.",
    "The response hash proves retrieval of the owner source; evidence classification and review determine what the source supports.",
    "The live public source may change after this study date."
  ],
  "owner_url": "https://design.visa.com/",
  "permitted_use_basis": "original-analysis-from-ordinary-public-access",
  "retrieved_at": "2026-09-01",
  "schema_version": "1.0",
  "source_scope_id": "visa-design-system",
  "source_version": "live-public-source-2026-09-01:f4497ae45757",
  "terms_or_license_url": null,
  "third_party_assets_stored": false
}
